{
  "schemaVersion": "1.0",
  "projectId": "soc-brain",
  "repository": "duongpdddic-droid/Soc_brain",
  "projectType": "control-plane",
  "workspace": { "workspaceId": "soc-brain-main" },
  "policy": { "version": "1.0.0" },
  "verify": { "adapter": "pnpm-verify" },
  "deploy": { "capability": false, "humanAuthorization": true },
  "telegram": { "route": "dm-boss" },
  "memory": { "provider": "claude-mem", "namespace": "soc-brain" },
  "allowedOverrides": []
}
