{
  "schemaVersion": "1.0",
  "projectId": "ai-pr-reviewer",
  "repository": "duongpdddic-droid/AI_PR_REVIEWER",
  "projectType": "control-plane",
  "workspace": { "workspaceId": "ai-pr-reviewer-main" },
  "policy": { "version": "1.0.0" },
  "verify": { "adapter": "pnpm-verify" },
  "deploy": { "capability": false, "humanAuthorization": true },
  "telegram": { "route": "dm-boss" },
  "memory": { "provider": "claude-mem", "namespace": "ai-pr-reviewer" },
  "allowedOverrides": []
}
