{
  "schemaVersion": "1.0",
  "projectId": "generic-demo",
  "repository": "example-org/generic-demo",
  "projectType": "product",
  "workspace": { "workspaceId": "generic-demo-ws" },
  "policy": { "version": "1.0.0" },
  "verify": { "adapter": "pnpm-verify" },
  "deploy": { "capability": false, "humanAuthorization": true },
  "telegram": { "route": "project-channel" },
  "memory": { "provider": "claude-mem", "namespace": "generic-demo" },
  "allowedOverrides": []
}
